{
  "$schema": "https://json-schema.org/draft/2020-12/schema",
  "title": "browser-check private config (ego lite)",
  "description": "Lives in ${CLAUDE_PLUGIN_DATA}/config.json (0600, parent 0700). `browser-check setup` writes it; `setup --migrate` replaces an old Aside (schemaVersion 1) file. Unknown keys are rejected.",
  "type": "object",
  "additionalProperties": false,
  "required": ["schemaVersion", "ego"],
  "properties": {
    "schemaVersion": { "const": 2 },
    "ego": {
      "type": "object",
      "additionalProperties": false,
      "description": "Either bin (ego lite on this machine — the PC) or remoteHost (a server: the PC over ssh, through the browser_check relay).",
      "properties": {
        "enabled": { "type": "boolean", "default": true },
        "bin": { "type": "string", "description": "absolute path to ego-browser.exe (setup prefers ~/.local/share/ego/active_version_dir, which follows ego updates)" },
        "remoteHost": { "type": "string", "description": "ssh Host of the PC (key login); the relay must be installed there (`relay install`)" },
        "relayEntry": { "type": "string", "default": "%LOCALAPPDATA%\\browser-check\\relay\\entry.cmd", "description": "the PC path of the relay entry, as the PC's cmd.exe sees it" },
        "relayDir": { "type": "string", "description": "the PC relay folder (setup reads it from the relay); window.ps1 there reopens a closed ego window minimized" },
        "callTimeoutMs": { "type": "integer", "minimum": 5000, "maximum": 1800000, "default": 300000 },
        "settleMs": { "type": "integer", "minimum": 1000, "maximum": 120000, "default": 15000, "description": "how long bc.finish waits for 0 requests in flight before it leaves the space open instead of closing it" },
        "light": { "type": "boolean", "default": true, "description": "force prefers-color-scheme: light in bc.prep (ego's own theme can be dark)" }
      }
    },
    "artifacts": {
      "type": "object",
      "additionalProperties": false,
      "properties": {
        "dir": { "type": "string", "description": "absolute; default ${CLAUDE_PLUGIN_DATA}/artifacts" },
        "retentionDays": { "type": "integer", "minimum": 1, "maximum": 90, "default": 7 },
        "storeScreenshots": { "type": "boolean", "default": true }
      }
    },
    "sites": {
      "type": "array",
      "description": "Per-site rules. setup never guesses them; without a rule the safe defaults apply.",
      "items": {
        "type": "object",
        "additionalProperties": false,
        "required": ["match"],
        "properties": {
          "match": { "type": "string", "description": "origin or origin+path, * as wildcard" },
          "login": { "enum": ["none", "rotating-refresh", "session-cookie"], "default": "none" },
          "allowDataMutation": { "type": "boolean", "default": false },
          "authPathPrefixes": { "type": "array", "items": { "type": "string" } },
          "guardWrites": { "type": "boolean", "default": false, "description": "turn the in-page write guard on for this site" },
          "writeAllow": { "type": "array", "items": { "type": "string" }, "description": "paths the guard lets through — on a logged-in site include its token-refresh path, or the page falls back to its login screen" }
        }
      }
    }
  }
}
